<?xml version="1.0" encoding="UTF-8"?>
<index xmlns:xsi="http://www.w3.org/2001/XMLSchema-instance" xsi:noNamespaceSchemaLocation="http://www.vplants.org/metadata/vpindex.xsd"><herbcd>F</herbcd><taxon><link>http://vplants.mortonarb.org/fm/data/I/IOPI.xml</link><link>http://vplants.mortonarb.org/fm/data/I/ISTI.xml</link><link>http://vplants.mortonarb.org/fm/data/L/LECA5.xml</link><link>http://vplants.mortonarb.org/fm/data/L/LEDE.xml</link><link>http://vplants.mortonarb.org/fm/data/L/LEDR.xml</link><link>http://vplants.mortonarb.org/fm/data/L/LELA2.xml</link><link>http://vplants.mortonarb.org/fm/data/L/LEPE2.xml</link><link>http://vplants.mortonarb.org/fm/data/L/LERU.xml</link><link>http://vplants.mortonarb.org/fm/data/L/LESA2.xml</link><link>http://vplants.mortonarb.org/fm/data/L/LEVI3.xml</link><link>http://vplants.mortonarb.org/fm/data/L/LEGR2.xml</link><link>http://vplants.mortonarb.org/fm/data/L/LOMA.xml</link><link>http://vplants.mortonarb.org/fm/data/L/LUAN.xml</link><link>http://vplants.mortonarb.org/fm/data/M/MAAF.xml</link><link>http://vplants.mortonarb.org/fm/data/M/MAIN4.xml</link><link>http://vplants.mortonarb.org/fm/data/V/VP-136.xml</link><link>http://vplants.mortonarb.org/fm/data/N/NEPA3.xml</link><link>http://vplants.mortonarb.org/fm/data/R/RARA2.xml</link><link>http://vplants.mortonarb.org/fm/data/R/RASA2.xml</link><link>http://vplants.mortonarb.org/fm/data/V/VP-62.xml</link><link>http://vplants.mortonarb.org/fm/data/R/RARU.xml</link></taxon></index>